{
  "title": "The Question That Remains",
  "fps": 24,
  "audio": "intentional_silence",
  "cuts": {
    "master": {
      "width": 1920,
      "height": 1080,
      "duration_ms": 495000,
      "segments": [
        {
          "segment_id": "S01",
          "start_ms": 0,
          "duration_ms": 6000,
          "movement": "THE QUESTION",
          "kind": "silence",
          "title": "",
          "body": "",
          "clip_id": null,
          "citation": "",
          "asset_ids": [
            "DESIGN",
            "FONTS"
          ],
          "quote_asset_id": null,
          "motif": "void"
        },
        {
          "segment_id": "S02",
          "start_ms": 6000,
          "duration_ms": 12000,
          "movement": "THE QUESTION",
          "kind": "card",
          "title": "What is greatness?",
          "body": "",
          "clip_id": null,
          "citation": "",
          "asset_ids": [
            "DESIGN",
            "FONTS"
          ],
          "quote_asset_id": null,
          "motif": "columns"
        },
        {
          "segment_id": "S03",
          "start_ms": 18000,
          "duration_ms": 10000,
          "movement": "THE QUESTION",
          "kind": "card",
          "title": "What survives death?",
          "body": "",
          "clip_id": null,
          "citation": "",
          "asset_ids": [
            "DESIGN",
            "FONTS"
          ],
          "quote_asset_id": null,
          "motif": "orbit"
        },
        {
          "segment_id": "S04",
          "start_ms": 28000,
          "duration_ms": 10000,
          "movement": "THE QUESTION",
          "kind": "card",
          "title": "What is truth?",
          "body": "",
          "clip_id": null,
          "citation": "",
          "asset_ids": [
            "DESIGN",
            "FONTS"
          ],
          "quote_asset_id": null,
          "motif": "light"
        },
        {
          "segment_id": "S05",
          "start_ms": 38000,
          "duration_ms": 12000,
          "movement": "THE QUESTION",
          "kind": "title",
          "title": "THE QUESTION\nTHAT REMAINS",
          "body": "Power. Knowledge. Art. Victory.\nAn unfinished encounter with Jesus.",
          "clip_id": null,
          "citation": "",
          "asset_ids": [
            "DESIGN",
            "FONTS"
          ],
          "quote_asset_id": null,
          "motif": "light"
        },
        {
          "segment_id": "S06",
          "start_ms": 50000,
          "duration_ms": 10000,
          "movement": "POWER",
          "kind": "chapter",
          "title": "01 / POWER",
          "body": "The reach of a voice.",
          "clip_id": null,
          "citation": "",
          "asset_ids": [
            "DESIGN",
            "FONTS"
          ],
          "quote_asset_id": null,
          "motif": "columns"
        },
        {
          "segment_id": "S07",
          "start_ms": 60000,
          "duration_ms": 15000,
          "movement": "POWER",
          "kind": "placeholder",
          "title": "John F. Kennedy",
          "body": "Christmas-tree remarks / 1962\nContext only: public language of peace.",
          "clip_id": "JFK_TREE_001",
          "citation": "JFK Library • JFKWHA-155-008",
          "asset_ids": [
            "DESIGN",
            "FONTS"
          ],
          "quote_asset_id": null,
          "motif": "columns"
        },
        {
          "segment_id": "S08",
          "start_ms": 75000,
          "duration_ms": 20000,
          "movement": "POWER",
          "kind": "placeholder",
          "title": "Ronald Reagan",
          "body": "Christmas radio address / 1983\nProposed focus: his distinction between teacher and divine Son.",
          "clip_id": "REAGAN_XMAS_001",
          "citation": "Reagan Library • 24 December 1983",
          "asset_ids": [
            "DESIGN",
            "FONTS"
          ],
          "quote_asset_id": null,
          "motif": "columns"
        },
        {
          "segment_id": "S09",
          "start_ms": 95000,
          "duration_ms": 10000,
          "movement": "POWER",
          "kind": "card",
          "title": "Does influence\nsettle what is true?",
          "body": "A person’s stature is not proof of a belief.",
          "clip_id": null,
          "citation": "",
          "asset_ids": [
            "DESIGN",
            "FONTS"
          ],
          "quote_asset_id": null,
          "motif": "columns"
        },
        {
          "segment_id": "S10",
          "start_ms": 105000,
          "duration_ms": 15000,
          "movement": "POWER",
          "kind": "placeholder",
          "title": "George W. Bush",
          "body": "1999 debate / acquisition pending\nProposed focus: a personal account of changed conviction.",
          "clip_id": "BUSH_DEBATE_001",
          "citation": "C-SPAN • lead in source ledger",
          "asset_ids": [
            "DESIGN",
            "FONTS"
          ],
          "quote_asset_id": null,
          "motif": "columns"
        },
        {
          "segment_id": "S11",
          "start_ms": 120000,
          "duration_ms": 10000,
          "movement": "POWER",
          "kind": "card",
          "title": "A claim is an invitation\nto listen carefully.",
          "body": "And to ask what kind of claim it is.",
          "clip_id": null,
          "citation": "",
          "asset_ids": [
            "DESIGN",
            "FONTS"
          ],
          "quote_asset_id": null,
          "motif": "light"
        },
        {
          "segment_id": "S12",
          "start_ms": 130000,
          "duration_ms": 10000,
          "movement": "KNOWLEDGE",
          "kind": "chapter",
          "title": "02 / KNOWLEDGE",
          "body": "The reach of an explanation.",
          "clip_id": null,
          "citation": "",
          "asset_ids": [
            "DESIGN",
            "FONTS"
          ],
          "quote_asset_id": null,
          "motif": "orbit"
        },
        {
          "segment_id": "S13",
          "start_ms": 140000,
          "duration_ms": 25000,
          "movement": "KNOWLEDGE",
          "kind": "placeholder",
          "title": "Francis Collins",
          "body": "A Testimony / recording date unverified\nProposed focus: a physician’s account of belief.",
          "clip_id": "COLLINS_TESTIMONY_001",
          "citation": "BioLogos • A Testimony",
          "asset_ids": [
            "DESIGN",
            "FONTS"
          ],
          "quote_asset_id": null,
          "motif": "orbit"
        },
        {
          "segment_id": "S14",
          "start_ms": 165000,
          "duration_ms": 10000,
          "movement": "KNOWLEDGE",
          "kind": "card",
          "title": "Does explanation\nexhaust meaning?",
          "body": "",
          "clip_id": null,
          "citation": "",
          "asset_ids": [
            "DESIGN",
            "FONTS"
          ],
          "quote_asset_id": null,
          "motif": "orbit"
        },
        {
          "segment_id": "S15",
          "start_ms": 175000,
          "duration_ms": 15000,
          "movement": "KNOWLEDGE",
          "kind": "placeholder",
          "title": "John Lennox",
          "body": "Resurrection lecture / source unverified\nAn argument to examine, not a scientific consensus.",
          "clip_id": "LENNOX_RESURRECTION_001",
          "citation": "Original lecture and permissions needed",
          "asset_ids": [
            "DESIGN",
            "FONTS"
          ],
          "quote_asset_id": null,
          "motif": "orbit"
        },
        {
          "segment_id": "S16",
          "start_ms": 190000,
          "duration_ms": 10000,
          "movement": "KNOWLEDGE",
          "kind": "card",
          "title": "Belief. Argument. Doubt.",
          "body": "Different ways of approaching the question.",
          "clip_id": null,
          "citation": "",
          "asset_ids": [
            "DESIGN",
            "FONTS"
          ],
          "quote_asset_id": null,
          "motif": "light"
        },
        {
          "segment_id": "S17",
          "start_ms": 200000,
          "duration_ms": 10000,
          "movement": "ART",
          "kind": "chapter",
          "title": "03 / ART",
          "body": "What remains when the applause ends?",
          "clip_id": null,
          "citation": "",
          "asset_ids": [
            "DESIGN",
            "FONTS"
          ],
          "quote_asset_id": null,
          "motif": "ripple"
        },
        {
          "segment_id": "S18",
          "start_ms": 210000,
          "duration_ms": 20000,
          "movement": "ART",
          "kind": "placeholder",
          "title": "Bono",
          "body": "The Meaning of Life / 2013 broadcast lead\nProposed focus: the identity of Jesus.",
          "clip_id": "BONO_MEANING_001",
          "citation": "RTÉ • full interview requested in acquisition plan",
          "asset_ids": [
            "DESIGN",
            "FONTS"
          ],
          "quote_asset_id": null,
          "motif": "ripple"
        },
        {
          "segment_id": "S19",
          "start_ms": 230000,
          "duration_ms": 20000,
          "movement": "ART",
          "kind": "placeholder",
          "title": "Stephen Fry",
          "body": "The Meaning of Life / 2015 broadcast lead\nThe problem of suffering; a challenge about God.",
          "clip_id": "FRY_QUESTION_001",
          "citation": "RTÉ Archives • broader theism, not conversion",
          "asset_ids": [
            "DESIGN",
            "FONTS"
          ],
          "quote_asset_id": null,
          "motif": "ripple"
        },
        {
          "segment_id": "S20",
          "start_ms": 250000,
          "duration_ms": 10000,
          "movement": "ART",
          "kind": "card",
          "title": "Let the objection stand.",
          "body": "The next voice is not an answer placed in his mouth.",
          "clip_id": null,